Spacecraft Spots Probable Waves On Titan's Seas,http://rss.slashdot.org/~r/Slashdot/slashdot/~3/GgS3hlMzSd4/story01.htm,"sciencehabit writes: It's springtime on Titan, Saturn's giant and frigid moon, and the action on its hydrocarbon seas seems to be heating up. Near the moon's north pole, there is growing evidence for waves on three different seas, scientists reported at a meeting of the American Geophysical Union. Researchers are also coming up with the first estimates for the volume and composition of the seas. The bodies of water appear to be made mostly of methane, and not mostly ethane as previously thought. And they are deep: Ligeia Mare, the second biggest sea with an area larger than Lake Superior, could contain 55 times Earth's oil reserves.<p><div class=""share_submission"" style=""position:relative;""> <a class=""slashpop"" href=""http://twitter.com/home?status=Spacecraft+Spots+Probable+Waves+On+Titan's+Seas%3A+http%3A%2F%2Fbit.ly%2F1z2iOlF""><img src=""http://a.fsdn.com/sd/twitter_icon_large.png""></a> <a class=""slashpop"" href=""http://www.facebook.com/sharer.php?u=http%3A%2F%2Fscience.slashdot.org%2Fstory%2F14%2F12%2F17%2F0517242%2Fspacecraft-spots-probable-waves-on-titans-seas%3Futm_source%3Dslashdot%26utm_medium%3Dfacebook""><img src=""http://a.fsdn.com/sd/facebook_icon_large.png""></a> <a class=""nobg"" href=""http://plus.google.com/share?url=http://science.slashdot.org/story/14/12/17/0517242/spacecraft-spots-probable-waves-on-titans-seas?utm_source=slashdot&amp;utm_medium=googleplus"" onclick=""javascript:window.open(this.href,'', 'menubar=no,toolbar=no,resizable=yes,scrollbars=yes,height=600,width=600');return false;""><img src=""http://www.gstatic.com/images/icons/gplus-16.png"" alt=""Share on Google+""/></a> </div></p><p><a href=""http://science.slashdot.org/story/14/12/17/0517242/spacecraft-spots-probable-waves-on-titans-seas?utm_source=rss1.0moreanon&amp;utm_medium=feed"">Read more of this story</a> at Slashdot.</p><iframe src=""http://slashdot.org/slashdot-it.pl?op=discuss&amp;id=6421293&amp;smallembed=1"" style=""height: 300px; width: 100%; border: none;""></iframe><img width='1' height='1' src='http://slashdot.feedsportal.com/c/35028/f/647410/s/418503e6/sc/10/mf.gif' border='0'/><br clear='all'/><br/><br/><a href=""http://da.feedsportal.com/r/216364910578/u/49/f/647410/c/35028/s/418503e6/sc/10/rc/1/rc.htm"" rel=""nofollow""><img src=""http://da.feedsportal.com/r/216364910578/u/49/f/647410/c/35028/s/418503e6/sc/10/rc/1/rc.img"" border=""0""/></a><br/><a href=""http://da.feedsportal.com/r/216364910578/u/49/f/647410/c/35028/s/418503e6/sc/10/rc/2/rc.htm"" rel=""nofollow""><img src=""http://da.feedsportal.com/r/216364910578/u/49/f/647410/c/35028/s/418503e6/sc/10/rc/2/rc.img"" border=""0""/></a><br/><a href=""http://da.feedsportal.com/r/216364910578/u/49/f/647410/c/35028/s/418503e6/sc/10/rc/3/rc.htm"" rel=""nofollow""><img src=""http://da.feedsportal.com/r/216364910578/u/49/f/647410/c/35028/s/418503e6/sc/10/rc/3/rc.img"" border=""0""/></a><br/><br/><a href=""http://da.feedsportal.com/r/216364910578/u/49/f/647410/c/35028/s/418503e6/sc/10/a2.htm""><img src=""http://da.feedsportal.com/r/216364910578/u/49/f/647410/c/35028/s/418503e6/sc/10/a2.img"" border=""0""/></a><img width=""1"" height=""1"" src=""http://pi.feedsportal.com/r/216364910578/u/49/f/647410/c/35028/s/418503e6/sc/10/a2t.img"" border=""0""/><img src=""//feeds.feedburner.com/~r/Slashdot/slashdot/~4/GgS3hlMzSd4"" height=""1"" width=""1"" alt=""""/>"
Spying on Animals' Movements to Learn How They're Feeling (Discover Magazine),http://news.feedzilla.com/en_us/stories/science/411280496?client_source=api&format=json,"Rory Wilson recalls some nervous waterbirds. ""I've seen pelicans in Galapagos,
in the port,"" the Swansea University biologist says. One set of birds was
standing by the fish-gutting area and waiting for scraps, while another group
stood out of the fray in some nearby bushes. Although both sets of pelicans
acted the same, a closer look at the birds waiting for fish scraps revealed
that they were quaking slightly. The tips of their wings trembled. Wilson
thinks the tremor in the pelicans

"
Stunning Before and After Photographs Show the Impact of Global Warming on Greenland's Glaciers (Discover Magazine),http://news.feedzilla.com/en_us/stories/science/411250321?client_source=api&format=json,"I love NASA's Earth Observatory so much that I check in with it every day
knowing I'll be rewarded with a visual treat about the Earth. But I'm a
journalist, which means I have an urge to try to break news first. That
includes beating the folks at EO to big, visual, Earth and environmental
sciences stories (which I'm proud to say I've done from time to time). Today,
though, I just have to share the Earth Observatory's imagery as is. It
consists of the two photographs above of the Sukk

"
Surreal Aerial Photos Show Impact From Fracking (climateark),http://news.feedzilla.com/en_us/stories/science/411250267?client_source=api&format=json,"EcoWatch: Sometimes it takes a bird’s eye view to get a sense of the full
scope of what’s being done to our land in pursuit of profit. A few weeks ago
we ran some photos by artist Mishka Henner who creates projects that make
people think about how we interact with our environment. Those photos showed
industrial-scale feed lots, factory farms where thousands of animals are
raised, taken from the air. He discovered them while flying over the country
working on another project: aerial photos of oil drilling...

"
"Verizon ""End-to-End"" Encrypted Calling Includes Law Enforcement Backdoor",http://rss.slashdot.org/~r/Slashdot/slashdot/~3/67qpXdtZJaY/story01.htm,"An anonymous reader sends this quote from TechDirt: As a string of whistle blowers like former AT&amp;T employee Mark Klein have made clear abundantly clear, the line purportedly separating intelligence operations from the nation's incumbent phone companies was all-but obliterated long ago. As such, it's relatively amusing to see Verizon announce this week that the company is offering up a new encrypted wireless voice service named Voice Cypher. Voice Cypher, Verizon states, offers ""end-to-end"" encryption for voice calls on iOS, Android, or BlackBerry devices equipped with a special app made by Cellcrypt. Verizon says it's initially pitching the $45 per phone service to government agencies and corporations, but would ultimately love to offer it to consumers as a line item on your bill. Of course by ""end-to-end encryption,"" Verizon means that the new $45 per phone service includes an embedded NSA backdoor free of charge. Apparently, in Verizon-land, ""end-to-end encryption"" means something entirely different than it does in the real world.<p><div class=""share_submission"" style=""position:relative;""> <a class=""slashpop"" href=""http://twitter.com/home?status=Verizon+%22End-to-End%22+Encrypted+Calling+Includes+Law+Enforcement+Backdoor%3A+http%3A%2F%2Fbit.ly%2F1z0F9Qk""><img src=""http://a.fsdn.com/sd/twitter_icon_large.png""></a> <a class=""slashpop"" href=""http://www.facebook.com/sharer.php?u=http%3A%2F%2Fyro.slashdot.org%2Fstory%2F14%2F12%2F16%2F2230217%2Fverizon-end-to-end-encrypted-calling-includes-law-enforcement-backdoor%3Futm_source%3Dslashdot%26utm_medium%3Dfacebook""><img src=""http://a.fsdn.com/sd/facebook_icon_large.png""></a> <a class=""nobg"" href=""http://plus.google.com/share?url=http://yro.slashdot.org/story/14/12/16/2230217/verizon-end-to-end-encrypted-calling-includes-law-enforcement-backdoor?utm_source=slashdot&amp;utm_medium=googleplus"" onclick=""javascript:window.open(this.href,'', 'menubar=no,toolbar=no,resizable=yes,scrollbars=yes,height=600,width=600');return false;""><img src=""http://www.gstatic.com/images/icons/gplus-16.png"" alt=""Share on Google+""/></a> </div></p><p><a href=""http://yro.slashdot.org/story/14/12/16/2230217/verizon-end-to-end-encrypted-calling-includes-law-enforcement-backdoor?utm_source=rss1.0moreanon&amp;utm_medium=feed"">Read more of this story</a> at Slashdot.</p><iframe src=""http://slashdot.org/slashdot-it.pl?op=discuss&amp;id=6419297&amp;smallembed=1"" style=""height: 300px; width: 100%; border: none;""></iframe><img width='1' height='1' src='http://slashdot.feedsportal.com/c/35028/f/647410/s/4182bccf/sc/15/mf.gif' border='0'/><br clear='all'/><br/><br/><a href=""http://da.feedsportal.com/r/216364936261/u/49/f/647410/c/35028/s/4182bccf/sc/15/rc/1/rc.htm"" rel=""nofollow""><img src=""http://da.feedsportal.com/r/216364936261/u/49/f/647410/c/35028/s/4182bccf/sc/15/rc/1/rc.img"" border=""0""/></a><br/><a href=""http://da.feedsportal.com/r/216364936261/u/49/f/647410/c/35028/s/4182bccf/sc/15/rc/2/rc.htm"" rel=""nofollow""><img src=""http://da.feedsportal.com/r/216364936261/u/49/f/647410/c/35028/s/4182bccf/sc/15/rc/2/rc.img"" border=""0""/></a><br/><a href=""http://da.feedsportal.com/r/216364936261/u/49/f/647410/c/35028/s/4182bccf/sc/15/rc/3/rc.htm"" rel=""nofollow""><img src=""http://da.feedsportal.com/r/216364936261/u/49/f/647410/c/35028/s/4182bccf/sc/15/rc/3/rc.img"" border=""0""/></a><br/><br/><a href=""http://da.feedsportal.com/r/216364936261/u/49/f/647410/c/35028/s/4182bccf/sc/15/a2.htm""><img src=""http://da.feedsportal.com/r/216364936261/u/49/f/647410/c/35028/s/4182bccf/sc/15/a2.img"" border=""0""/></a><img width=""1"" height=""1"" src=""http://pi.feedsportal.com/r/216364936261/u/49/f/647410/c/35028/s/4182bccf/sc/15/a2t.img"" border=""0""/><img src=""//feeds.feedburner.com/~r/Slashdot/slashdot/~4/67qpXdtZJaY"" height=""1"" width=""1"" alt=""""/>"
Weak deal at Lima climate talks disappoints climate hawks (ecoearth.info),http://news.feedzilla.com/en_us/stories/science/411250330?client_source=api&format=json,"Grist: The U.N. climate summit kicked off two weeks ago with an unfamiliar
sense of optimism, invigorated by the recent agreement between the United
States and China. But it ended with an all-too-familiar sense of
disappointment. On early Sunday morning, delegates delivered a vague, four-
page document that does little more than set the terms for what the parties
will be battling over at the next big summit in Paris a year from now. After
two weeks huddled in sweaty, sweltering tents (yes, many a “greenhouse...

"
